CIK,SeriesID,Fund,ContractID,Class,Ticker
0001100663,S000057341,iShares High Yield Bond Factor ETF,C000182992,iShares High Yield Bond Factor ETF,HYDB
0001100663,S000057342,iShares Investment Grade Bond Factor ETF,C000182993,iShares Investment Grade Bond Factor ETF,IGEB
0001100663,S000057567,iShares Russell 2500 ETF,C000183467,iShares Russell 2500 ETF,SMMD
0001100663,S000058036,iShares ESG Aware 1-5 Year USD Corporate Bond ETF,C000189864,iShares ESG Aware 1-5 Year USD Corporate Bond ETF,SUSB
0001100663,S000058037,iShares ESG Aware USD Corporate Bond ETF,C000189865,iShares ESG Aware USD Corporate Bond ETF,SUSC
0001100663,S000058301,iShares iBonds Dec 2027 Term Corporate ETF,C000191091,iShares iBonds Dec 2027 Term Corporate ETF,IBDS
0001100663,S000059297,iShares Broad USD High Yield Corporate Bond ETF,C000194633,iShares Broad USD High Yield Corporate Bond ETF,USHY
0001100663,S000059298,iShares U.S. Dividend and Buyback ETF,C000194634,iShares U.S. Dividend and Buyback ETF,DIVB
0001100663,S000060088,iShares U.S. Fixed Income Balanced Risk Factor ETF,C000196720,iShares U.S. Fixed Income Balanced Risk Factor ETF,FIBR
0001100663,S000061314,iShares U.S. Infrastructure ETF,C000198491,iShares U.S. Infrastructure ETF,IFRA
0001100663,S000061604,iShares ESG Aware MSCI USA Small-Cap ETF,C000199548,iShares ESG Aware MSCI USA Small-Cap ETF,ESML
0001100663,S000062159,iShares ESG Aware U.S. Aggregate Bond ETF,C000201167,iShares ESG Aware U.S. Aggregate Bond ETF,EAGG
0001100663,S000062201,iShares Robotics and Artificial Intelligence Multisector ETF,C000201209,iShares Robotics and Artificial Intelligence Multisector ETF,IRBO
0001100663,S000063041,iShares iBonds Dec 2028 Term Corporate ETF,C000204503,iShares iBonds Dec 2028 Term Corporate ETF,IBDT
0001100663,S000063114,iShares iBonds Dec 2025 Term Muni Bond ETF,C000204675,iShares iBonds Dec 2025 Term Muni Bond ETF,IBMN
0001100663,S000063115,iShares iBonds Dec 2026 Term Muni Bond ETF,C000204676,iShares iBonds Dec 2026 Term Muni Bond ETF,IBMO
0001100663,S000063139,iShares BB Rated Corporate Bond ETF,C000204721,iShares BB Rated Corporate Bond ETF,HYBB
0001100663,S000063466,iShares USD Green Bond ETF,C000205645,iShares USD Green Bond ETF,BGRN
0001100663,S000063520,iShares Self-Driving EV and Tech ETF,C000205801,iShares Self-Driving EV and Tech ETF,IDRV
0001100663,S000064771,iShares MSCI Japan Equal Weighted ETF,C000209759,iShares MSCI Japan Equal Weighted ETF,EWJE
0001100663,S000064903,iShares MSCI Japan Value ETF,C000210083,iShares MSCI Japan Value ETF,EWJV
0001100663,S000064965,iShares Focused Value Factor ETF,C000210345,iShares Focused Value Factor ETF,FOVL
0001100663,S000065014,iShares Cloud 5G and Tech ETF,C000210492,iShares Cloud 5G and Tech ETF,IDAT
0001100663,S000065015,iShares Cybersecurity and Tech ETF,C000210493,iShares Cybersecurity and Tech ETF,IHAK
0001100663,S000065128,iShares iBonds Dec 2027 Term Muni Bond ETF,C000210857,iShares iBonds Dec 2027 Term Muni Bond ETF,IBMP
0001100663,S000065129,iShares iBonds Dec 2028 Term Muni Bond ETF,C000210858,iShares iBonds Dec 2028 Term Muni Bond ETF,IBMQ
0001100663,S000065339,iShares iBonds 2022 Term High Yield and Income ETF,C000211398,iShares iBonds 2022 Term High Yield and Income ETF,IBHB
0001100663,S000065341,iShares iBonds 2023 Term High Yield and Income ETF,C000211400,iShares iBonds 2023 Term High Yield and Income ETF,IBHC
0001100663,S000065343,iShares iBonds 2024 Term High Yield and Income ETF,C000211402,iShares iBonds 2024 Term High Yield and Income ETF,IBHD
0001100663,S000065345,iShares iBonds 2025 Term High Yield and Income ETF,C000211404,iShares iBonds 2025 Term High Yield and Income ETF,IBHE
0001100663,S000065416,iShares MSCI USA Mid-Cap Multifactor ETF,C000211556,iShares MSCI USA Mid-Cap Multifactor ETF,MIDF
0001100663,S000065418,iShares ESG MSCI USA Leaders ETF,C000211558,iShares ESG MSCI USA Leaders ETF,SUSL
0001100663,S000065599,iShares Genomics Immunology and Healthcare ETF,C000212225,iShares Genomics Immunology and Healthcare ETF,IDNA
0001100663,S000066401,iShares iBonds Dec 2029 Term Corporate ETF,C000214263,iShares iBonds Dec 2029 Term Corporate ETF,IBDU
0001100663,S000066849,iShares Factors US Growth Style ETF,C000215209,iShares Factors US Growth Style ETF,STLG
0001100663,S000066851,iShares Factors US Value Style ETF,C000215211,iShares Factors US Value Style ETF,STLV
0001100663,S000067234,iShares U.S. Tech Breakthrough Multisector ETF,C000216288,iShares U.S. Tech Breakthrough Multisector ETF,TECB
0001100663,S000067557,iShares iBonds Dec 2022 Term Treasury ETF,C000217182,iShares iBonds Dec 2022 Term Treasury ETF,IBTB
0001100663,S000067558,iShares iBonds Dec 2023 Term Treasury ETF,C000217184,iShares iBonds Dec 2023 Term Treasury ETF,IBTD
0001100663,S000067559,iShares iBonds Dec 2024 Term Treasury ETF,C000217185,iShares iBonds Dec 2024 Term Treasury ETF,IBTE
0001100663,S000067560,iShares iBonds Dec 2025 Term Treasury ETF,C000217186,iShares iBonds Dec 2025 Term Treasury ETF,IBTF
0001100663,S000067561,iShares iBonds Dec 2026 Term Treasury ETF,C000217187,iShares iBonds Dec 2026 Term Treasury ETF,IBTG
0001100663,S000067562,iShares iBonds Dec 2027 Term Treasury ETF,C000217188,iShares iBonds Dec 2027 Term Treasury ETF,IBTH
0001100663,S000067563,iShares iBonds Dec 2028 Term Treasury ETF,C000217189,iShares iBonds Dec 2028 Term Treasury ETF,IBTI
0001100663,S000067564,iShares iBonds Dec 2029 Term Treasury ETF,C000217190,iShares iBonds Dec 2029 Term Treasury ETF,IBTJ
0001100663,S000067838,iShares ESG MSCI EM Leaders ETF,C000217590,iShares ESG MSCI EM Leaders ETF,LDEM
0001100663,S000068137,iShares MSCI Kuwait ETF,C000218229,iShares MSCI Kuwait ETF,KWT
0001100663,S000068729,iShares ESG Aware Conservative Allocation ETF,C000219699,iShares ESG Aware Conservative Allocation ETF,EAOK
0001100663,S000068730,iShares ESG Aware Moderate Allocation ETF,C000219700,iShares ESG Aware Moderate Allocation ETF,EAOM
0001100663,S000068731,iShares ESG Aware Growth Allocation ETF,C000219701,iShares ESG Aware Growth Allocation ETF,EAOR
0001100663,S000068732,iShares ESG Aware Aggressive Allocation ETF,C000219702,iShares ESG Aware Aggressive Allocation ETF,EAOA
0001100663,S000068768,iShares 0-3 Month Treasury Bond ETF,C000219740,iShares 0-3 Month Treasury Bond ETF,SGOV
0001100663,S000068771,iShares ESG Advanced MSCI EAFE ETF,C000219745,iShares ESG Advanced MSCI EAFE ETF,DMXF
0001100663,S000068773,iShares ESG Advanced MSCI EM ETF,C000219747,iShares ESG Advanced MSCI EM ETF,EMXF
0001100663,S000068775,iShares ESG Advanced MSCI USA ETF,C000219749,iShares ESG Advanced MSCI USA ETF,USXF
0001100663,S000068777,iShares iBonds Dec 2030 Term Corporate ETF,C000219751,iShares iBonds Dec 2030 Term Corporate ETF,IBDV
0001100663,S000068817,iShares ESG Advanced Total USD Bond Market ETF,C000219898,iShares ESG Advanced Total USD Bond Market ETF,EUSB
0001100663,S000068912,iShares iBonds Dec 2030 Term Treasury ETF,C000220170,iShares iBonds Dec 2030 Term Treasury ETF,IBTK
0001100663,S000069338,iShares Virtual Work and Life Multisector ETF,C000221317,iShares Virtual Work and Life Multisector ETF,IWFH
0001100663,S000069532,iShares ESG Screened S&P 500 ETF,C000221870,iShares ESG Screened S&P 500 ETF,XVV
0001100663,S000069533,iShares ESG Screened S&P Mid-Cap ETF,C000221871,iShares ESG Screened S&P Mid-Cap ETF,XJH
0001100663,S000069536,iShares ESG Screened S&P Small-Cap ETF,C000221874,iShares ESG Screened S&P Small-Cap ETF,XJR
0001100663,S000069558,iShares 25+ Year Treasury STRIPS Bond ETF,C000221912,iShares 25+ Year Treasury STRIPS Bond ETF,GOVZ
0001100663,S000069740,iShares US Small Cap Value Factor ETF,C000222498,iShares US Small Cap Value Factor ETF,SVAL
0001100663,S000069852,iShares iBonds 2026 Term High Yield and Income ETF,C000222633,iShares iBonds 2026 Term High Yield and Income ETF,IBHF
0001100663,S000070653,iShares International Developed Small Cap Value Factor ETF,C000224636,iShares International Developed Small Cap Value Factor ETF,ISVL
0001100663,S000071770,iShares BBB Rated Corporate Bond ETF,C000227271,iShares BBB Rated Corporate Bond ETF,LQDB
0001100663,S000072204,iShares iBonds Dec 2031 Term Corporate ETF,C000228040,iShares iBonds Dec 2031 Term Corporate ETF,IBDW
0001100663,S000072335,iShares iBonds 2027 Term High Yield and Income ETF,C000228465,iShares iBonds 2027 Term High Yield and Income ETF,IBHG
0001100663,S000072402,iShares iBonds Dec 2031 Term Treasury ETF,C000228602,iShares iBonds Dec 2031 Term Treasury ETF,IBTL
0001100663,S000073477,iShares USD Bond Factor ETF,C000230412,iShares USD Bond Factor ETF,USBF
0001100663,S000073837,iShares ESG MSCI USA Min Vol Factor ETF,C000231047,iShares ESG MSCI USA Min Vol Factor ETF,ESMV
0001100663,S000074168,iShares ESG Advanced Investment Grade Corporate Bond ETF,C000231752,iShares ESG Advanced Investment Grade Corporate Bond ETF,ELQD
0001100663,S000074555,iShares MSCI China Multisector Tech ETF,C000232534,iShares MSCI China Multisector Tech ETF,TCHI
0001100663,S000074757,iShares Paris-Aligned Climate MSCI USA ETF,C000232922,iShares Paris-Aligned Climate MSCI USA ETF,PABU
0001100663,S000075472,iShares iBonds 2028 Term High Yield and Income ETF,C000234589,iShares iBonds 2028 Term High Yield and Income ETF,IBHH
0001100663,S000075473,iShares iBonds 2029 Term High Yield and Income ETF,C000234590,iShares iBonds 2029 Term High Yield and Income ETF,IBHI
0001524513,S000037042,BlackRock Short Maturity Bond ETF,C000113876,BlackRock Short Maturity Bond ETF,NEAR
0001524513,S000040474,BlackRock Ultra Short-Term Bond ETF,C000125661,BlackRock Ultra Short-Term Bond ETF,ICSH
0001524513,S000042862,iShares Interest Rate Hedged Corporate Bond ETF,C000132817,iShares Interest Rate Hedged Corporate Bond ETF,LQDH
0001524513,S000042863,iShares Interest Rate Hedged High Yield Bond ETF,C000132818,iShares Interest Rate Hedged High Yield Bond ETF,HYGH
0001524513,S000044145,iShares Interest Rate Hedged Long-Term Corporate Bond ETF,C000137261,iShares Interest Rate Hedged Long-Term Corporate Bond ETF,IGBH
0001524513,S000044146,iShares Interest Rate Hedged Emerging Markets Bond ETF,C000137262,iShares Interest Rate Hedged Emerging Markets Bond ETF,EMBH
0001524513,S000044971,iShares GSCI Commodity Dynamic Roll Strategy ETF,C000139416,iShares GSCI Commodity Dynamic Roll Strategy ETF,COMT
0001524513,S000047352,BlackRock Short Maturity Municipal Bond ETF,C000148680,BlackRock Short Maturity Municipal Bond ETF,MEAR
0001524513,S000058011,iShares Inflation Hedged Corporate Bond ETF,C000189608,iShares Inflation Hedged Corporate Bond ETF,LQDI
0001524513,S000061161,iShares Gold Strategy ETF,C000198135,iShares Gold Strategy ETF,IAUF
0001524513,S000061254,iShares Evolved U.S. Consumer Staples ETF,C000198374,iShares Evolved U.S. Consumer Staples ETF,IECS
0001524513,S000061255,iShares Evolved U.S. Discretionary Spending ETF,C000198375,iShares Evolved U.S. Discretionary Spending ETF,IEDI
0001524513,S000061256,iShares Evolved U.S. Financials ETF,C000198376,iShares Evolved U.S. Financials ETF,IEFN
0001524513,S000061257,iShares Evolved U.S. Healthcare Staples ETF,C000198377,iShares Evolved U.S. Healthcare Staples ETF,IEHS
0001524513,S000061258,iShares Evolved U.S. Innovative Healthcare ETF,C000198378,iShares Evolved U.S. Innovative Healthcare ETF,IEIH
0001524513,S000061259,iShares Evolved U.S. Media and Entertainment ETF,C000198379,iShares Evolved U.S. Media and Entertainment ETF,IEME
0001524513,S000061260,iShares Evolved U.S. Technology ETF,C000198380,iShares Evolved U.S. Technology ETF,IETC
0001524513,S000061337,iShares Bloomberg Roll Select Commodity Strategy ETF,C000198581,iShares Bloomberg Roll Select Commodity Strategy ETF,CMDY
0001524513,S000064843,iShares Commodity Curve Carry Strategy ETF,C000209927,iShares Commodity Curve Carry Strategy ETF,CCRV
0001100663,S000004313,iShares Core S&P Small-Cap ETF,C000012043,iShares Core S&P Small-Cap ETF,IJR
0001100663,S000004318,iShares U.S. Basic Materials ETF,C000012048,iShares U.S. Basic Materials ETF,IYM
0001100663,S000004320,iShares U.S. Consumer Discretionary ETF,C000012050,iShares U.S. Consumer Discretionary ETF,IYC
0001100663,S000004321,iShares U.S. Energy ETF,C000012051,iShares U.S. Energy ETF,IYE
0001100663,S000004322,iShares U.S. Financial Services ETF,C000012052,iShares U.S. Financial Services ETF,IYG
0001100663,S000004323,iShares U.S. Financials ETF,C000012053,iShares U.S. Financials ETF,IYF
0001100663,S000004324,iShares U.S. Healthcare ETF,C000012054,iShares U.S. Healthcare ETF,IYH
0001100663,S000004325,iShares U.S. Industrials ETF,C000012055,iShares U.S. Industrials ETF,IYJ
0001100663,S000004328,iShares U.S. Real Estate ETF,C000012058,iShares U.S. Real Estate ETF,IYR
0001100663,S000004329,iShares U.S. Technology ETF,C000012059,iShares U.S. Technology ETF,IYW
0001100663,S000004330,iShares Dow Jones U.S. ETF,C000012060,iShares Dow Jones U.S. ETF,IYY
0001100663,S000004331,iShares U.S. Transportation ETF,C000012061,iShares U.S. Transportation ETF,IYT
0001100663,S000004332,iShares U.S. Utilities ETF,C000012062,iShares U.S. Utilities ETF,IDU
0001100663,S000004333,iShares U.S. Telecommunications ETF,C000012063,iShares U.S. Telecommunications ETF,IYZ
0001100663,S000004431,iShares U.S. Consumer Staples ETF,C000012194,iShares U.S. Consumer Staples ETF,IYK
0001100663,S000004436,iShares MSCI USA ESG Select ETF,C000012199,iShares MSCI USA ESG Select ETF,SUSA
0001100663,S000009414,iShares U.S. Oil & Gas Exploration & Production ETF,C000025768,iShares U.S. Oil & Gas Exploration & Production ETF,IEO
0001100663,S000009415,iShares U.S. Home Construction ETF,C000025769,iShares U.S. Home Construction ETF,ITB
0001100663,S000009416,iShares U.S. Oil Equipment & Services ETF,C000025770,iShares U.S. Oil Equipment & Services ETF,IEZ
0001100663,S000009417,iShares U.S. Pharmaceuticals ETF,C000025771,iShares U.S. Pharmaceuticals ETF,IHE
0001100663,S000009418,iShares U.S. Healthcare Providers ETF,C000025772,iShares U.S. Healthcare Providers ETF,IHF
0001100663,S000009419,iShares U.S. Medical Devices ETF,C000025773,iShares U.S. Medical Devices ETF,IHI
0001100663,S000009420,iShares U.S. Broker-Dealers &amp; Securities Exchanges ETF,C000025774,iShares U.S. Broker-Dealers &amp; Securities Exchanges ETF,IAI
0001100663,S000009421,iShares U.S. Insurance ETF,C000025775,iShares U.S. Insurance ETF,IAK
0001100663,S000009422,iShares U.S. Regional Banks ETF,C000025776,iShares U.S. Regional Banks ETF,IAT
0001100663,S000009423,iShares U.S. Aerospace & Defense ETF,C000025777,iShares U.S. Aerospace & Defense ETF,ITA
0001100663,S000013931,iShares MSCI KLD 400 Social ETF,C000038163,iShares MSCI KLD 400 Social ETF,DSI
0001100663,S000061314,iShares U.S. Infrastructure ETF,C000198491,iShares U.S. Infrastructure ETF,IFRA
0001100663,S000064965,iShares Focused Value Factor ETF,C000210345,iShares Focused Value Factor ETF,FOVL
0000930667,S000004266,iShares MSCI Emerging Markets ETF,C000011970,iShares MSCI Emerging Markets ETF,EEM
0000930667,S000019125,iShares MSCI Emerging Markets Small-Cap ETF,C000052897,iShares MSCI Emerging Markets Small-Cap ETF,EEMS
0000930667,S000032497,iShares MSCI Emerging Markets Min Vol Factor ETF,C000100212,iShares MSCI Emerging Markets Min Vol Factor ETF,EEMV
0000930667,S000032498,iShares MSCI Global Min Vol Factor ETF,C000100213,iShares MSCI Global Min Vol Factor ETF,ACWV
0000930667,S000035880,iShares MSCI Global Silver and Metals Miners ETF,C000109983,iShares MSCI Global Silver and Metals Miners ETF,SLVP
0000930667,S000035882,iShares MSCI Global Gold Miners ETF,C000109985,iShares MSCI Global Gold Miners ETF,RING
0000930667,S000035883,iShares MSCI Global Agriculture Producers ETF,C000109986,iShares MSCI Global Agriculture Producers ETF,VEGI
0000930667,S000035884,iShares MSCI Global Energy Producers ETF,C000109987,iShares MSCI Global Energy Producers ETF,FILL
0000930667,S000035885,iShares MSCI Global Metals & Mining Producers ETF,C000109988,iShares MSCI Global Metals & Mining Producers ETF,PICK
0000930667,S000036005,iShares MSCI Frontier and Select EM ETF,C000110342,iShares MSCI Frontier and Select EM ETF,FM
0000930667,S000038923,iShares Core MSCI Emerging Markets ETF,C000119708,iShares Core MSCI Emerging Markets ETF,IEMG
0000930667,S000045639,iShares Currency Hedged MSCI Emerging Markets ETF,C000141922,iShares Currency Hedged MSCI Emerging Markets ETF,HEEM
0000930667,S000049021,iShares MSCI Emerging Markets Multifactor ETF,C000154544,iShares MSCI Emerging Markets Multifactor ETF,EMGF
0000930667,S000054183,iShares ESG Aware MSCI EM ETF,C000170244,iShares ESG Aware MSCI EM ETF,ESGE
0000930667,S000057835,iShares MSCI Emerging Markets ex China ETF,C000186806,iShares MSCI Emerging Markets ex China ETF,EMXC
0001100663,S000021460,iShares MSCI ACWI ex U.S. ETF,C000061363,iShares MSCI ACWI ex U.S. ETF,ACWX
0001100663,S000021461,iShares MSCI ACWI ETF,C000061364,iShares MSCI ACWI ETF,ACWI
0001100663,S000038931,iShares Core MSCI Total International Stock ETF,C000119716,iShares Core MSCI Total International Stock ETF,IXUS
0001100663,S000047644,iShares MSCI ACWI Low Carbon Target ETF,C000149539,iShares MSCI ACWI Low Carbon Target ETF,CRBN
0001100663,S000048622,iShares MSCI Global Multifactor ETF,C000153270,iShares MSCI Global Multifactor ETF,ACWF
0001100663,S000049792,iShares Currency Hedged MSCI ACWI ex U.S. ETF,C000157303,iShares Currency Hedged MSCI ACWI ex U.S. ETF,HAWX
0001100663,S000067838,iShares ESG MSCI EM Leaders ETF,C000217590,iShares ESG MSCI EM Leaders ETF,LDEM
0001100663,S000068773,iShares ESG Advanced MSCI EM ETF,C000219747,iShares ESG Advanced MSCI EM ETF,EMXF
0001100663,S000075473,iShares iBonds 2029 Term High Yield and Income ETF,C000234590,iShares iBonds 2029 Term High Yield and Income ETF,IBHI
0001100663,S000075472,iShares iBonds 2028 Term High Yield and Income ETF,C000234589,iShares iBonds 2028 Term High Yield and Income ETF,IBHH
0000930667,S000036004,iShares Emerging Markets Dividend ETF,C000110341,iShares Emerging Markets Dividend ETF,DVYE
0001100663,S000022497,iShares Emerging Markets Infrastructure ETF,C000065073,iShares Emerging Markets Infrastructure ETF,EMIF
0001100663,S000023585,iShares Core Conservative Allocation ETF,C000069397,iShares Core Conservative Allocation ETF,AOK
0001100663,S000023586,iShares Core Moderate Allocation ETF,C000069398,iShares Core Moderate Allocation ETF,AOM
0001100663,S000023587,iShares Core Growth Allocation ETF,C000069399,iShares Core Growth Allocation ETF,AOR
0001100663,S000023588,iShares Core Aggressive Allocation ETF,C000069400,iShares Core Aggressive Allocation ETF,AOA
0001100663,S000036830,iShares Morningstar Multi-Asset Income ETF,C000112640,iShares Morningstar Multi-Asset Income ETF,IYLD
0001100663,S000068729,iShares ESG Aware Conservative Allocation ETF,C000219699,iShares ESG Aware Conservative Allocation ETF,EAOK
0001100663,S000068730,iShares ESG Aware Moderate Allocation ETF,C000219700,iShares ESG Aware Moderate Allocation ETF,EAOM
0001100663,S000068731,iShares ESG Aware Growth Allocation ETF,C000219701,iShares ESG Aware Growth Allocation ETF,EAOR
0001100663,S000068732,iShares ESG Aware Aggressive Allocation ETF,C000219702,iShares ESG Aware Aggressive Allocation ETF,EAOA
0000930667,S000004247,iShares MSCI Hong Kong ETF,C000011951,iShares MSCI Hong Kong ETF,EWH
0000930667,S000004248,iShares MSCI Italy ETF,C000011952,iShares MSCI Italy ETF,EWI
0000930667,S000004252,iShares MSCI Netherlands ETF,C000011956,iShares MSCI Netherlands ETF,EWN
0000930667,S000004253,iShares MSCI Pacific ex Japan ETF,C000011957,iShares MSCI Pacific ex Japan ETF,EPP
0000930667,S000004255,iShares MSCI South Africa ETF,C000011959,iShares MSCI South Africa ETF,EZA
0000930667,S000004256,iShares MSCI Spain ETF,C000011960,iShares MSCI Spain ETF,EWP
0000930667,S000004257,iShares MSCI Austria ETF,C000011961,iShares MSCI Austria ETF,EWO
0000930667,S000004259,iShares MSCI Sweden ETF,C000011963,iShares MSCI Sweden ETF,EWD
0000930667,S000004260,iShares MSCI Switzerland ETF,C000011964,iShares MSCI Switzerland ETF,EWL
0000930667,S000004263,iShares MSCI Belgium ETF,C000011967,iShares MSCI Belgium ETF,EWK
0000930667,S000004266,iShares MSCI Emerging Markets ETF,C000011970,iShares MSCI Emerging Markets ETF,EEM
0000930667,S000004267,iShares MSCI France ETF,C000011971,iShares MSCI France ETF,EWQ
0000930667,S000004268,iShares MSCI Eurozone ETF,C000011972,iShares MSCI Eurozone ETF,EZU
0000930667,S000004269,iShares MSCI Germany ETF,C000011973,iShares MSCI Germany ETF,EWG
0000930667,S000018069,iShares MSCI BRIC ETF,C000050065,iShares MSCI BRIC ETF,BKF
0000930667,S000018073,iShares MSCI Turkey ETF,C000050069,iShares MSCI Turkey ETF,TUR
0000930667,S000019125,iShares MSCI Emerging Markets Small-Cap ETF,C000052897,iShares MSCI Emerging Markets Small-Cap ETF,EEMS
0000930667,S000021462,iShares MSCI Israel ETF,C000061365,iShares MSCI Israel ETF,EIS
0000930667,S000032497,iShares MSCI Emerging Markets Min Vol Factor ETF,C000100212,iShares MSCI Emerging Markets Min Vol Factor ETF,EEMV
0000930667,S000032498,iShares MSCI Global Min Vol Factor ETF,C000100213,iShares MSCI Global Min Vol Factor ETF,ACWV
0000930667,S000033806,iShares J.P. Morgan EM Local Currency Bond ETF,C000104446,iShares J.P. Morgan EM Local Currency Bond ETF,LEMB
0000930667,S000035395,iShares MSCI World ETF,C000108746,iShares MSCI World ETF,URTH
0000930667,S000035880,iShares MSCI Global Silver and Metals Miners ETF,C000109983,iShares MSCI Global Silver and Metals Miners ETF,SLVP
0000930667,S000035882,iShares MSCI Global Gold Miners ETF,C000109985,iShares MSCI Global Gold Miners ETF,RING
0000930667,S000035883,iShares MSCI Global Agriculture Producers ETF,C000109986,iShares MSCI Global Agriculture Producers ETF,VEGI
0000930667,S000035884,iShares MSCI Global Energy Producers ETF,C000109987,iShares MSCI Global Energy Producers ETF,FILL
0000930667,S000035885,iShares MSCI Global Metals & Mining Producers ETF,C000109988,iShares MSCI Global Metals & Mining Producers ETF,PICK
0000930667,S000036005,iShares MSCI Frontier and Select EM ETF,C000110342,iShares MSCI Frontier and Select EM ETF,FM
0000930667,S000036776,iShares J.P. Morgan EM Corporate Bond ETF,C000112502,iShares J.P. Morgan EM Corporate Bond ETF,CEMB
0000930667,S000036777,iShares J.P. Morgan EM High Yield Bond ETF,C000112503,iShares J.P. Morgan EM High Yield Bond ETF,EMHY
0000930667,S000036906,iShares US & Intl High Yield Corp Bond ETF,C000112949,iShares US & Intl High Yield Corp Bond ETF,GHYG
0000930667,S000036907,iShares International High Yield Bond ETF,C000112950,iShares International High Yield Bond ETF,HYXU
0000930667,S000038923,iShares Core MSCI Emerging Markets ETF,C000119708,iShares Core MSCI Emerging Markets ETF,IEMG
0000930667,S000040976,iShares MSCI Colombia ETF,C000127144,iShares MSCI Colombia ETF,ICOL
0000930667,S000045639,iShares Currency Hedged MSCI Emerging Markets ETF,C000141922,iShares Currency Hedged MSCI Emerging Markets ETF,HEEM
0000930667,S000047227,iShares MSCI Russia ETF,C000147985,iShares MSCI Russia ETF,ERUS
0000930667,S000049021,iShares MSCI Emerging Markets Multifactor ETF,C000154544,iShares MSCI Emerging Markets Multifactor ETF,EMGF
0000930667,S000054183,iShares ESG Aware MSCI EM ETF,C000170244,iShares ESG Aware MSCI EM ETF,ESGE
0000930667,S000057835,iShares MSCI Emerging Markets ex China ETF,C000186806,iShares MSCI Emerging Markets ex China ETF,EMXC
0001100663,S000004305,iShares Global Tech ETF,C000012035,iShares Global Tech ETF,IXN
0001100663,S000004315,iShares Europe ETF,C000012045,iShares Europe ETF,IEV
0001100663,S000004326,iShares Global 100 ETF,C000012056,iShares Global 100 ETF,IOO
0001100663,S000004348,iShares Latin America 40 ETF,C000012078,iShares Latin America 40 ETF,ILF
0001100663,S000004350,iShares Biotechnology ETF,C000012080,iShares Biotechnology ETF,IBB
0001100663,S000004351,iShares MSCI EAFE ETF,C000012081,iShares MSCI EAFE ETF,EFA
0001100663,S000004354,iShares Semiconductor ETF,C000012084,iShares Semiconductor ETF,SOXX
0001100663,S000004359,iShares Global Energy ETF,C000012089,iShares Global Energy ETF,IXC
0001100663,S000004361,iShares iBoxx $ Investment Grade Corporate Bond ETF,C000012091,iShares iBoxx $ Investment Grade Corporate Bond ETF,LQD
0001100663,S000004362,iShares Core U.S. Aggregate Bond ETF,C000012092,iShares Core U.S. Aggregate Bond ETF,AGG
0001100663,S000004370,iShares Global Financials ETF,C000012100,iShares Global Financials ETF,IXG
0001100663,S000004372,iShares Global Healthcare ETF,C000012102,iShares Global Healthcare ETF,IXJ
0001100663,S000004373,iShares Global Comm Services ETF,C000012103,iShares Global Comm Services ETF,IXP
0001100663,S000004437,iShares MSCI EAFE Growth ETF,C000012200,iShares MSCI EAFE Growth ETF,EFG
0001100663,S000004438,iShares MSCI EAFE Value ETF,C000012201,iShares MSCI EAFE Value ETF,EFV
0001100663,S000008880,iShares Global Consumer Discretionary ETF,C000024194,iShares Global Consumer Discretionary ETF,RXI
0001100663,S000008881,iShares Global Consumer Staples ETF,C000024195,iShares Global Consumer Staples ETF,KXI
0001100663,S000008882,iShares Global Industrials ETF,C000024196,iShares Global Industrials ETF,EXI
0001100663,S000008883,iShares Global Utilities ETF,C000024197,iShares Global Utilities ETF,JXI
0001100663,S000008884,iShares Global Materials ETF,C000024198,iShares Global Materials ETF,MXI
0001100663,S000013697,iShares 1-5 Year Investment Grade Corporate Bond ETF,C000037539,iShares 1-5 Year Investment Grade Corporate Bond ETF,IGSB
0001100663,S000013698,iShares 5-10 Year Investment Grade Corporate Bond ETF,C000037540,iShares 5-10 Year Investment Grade Corporate Bond ETF,IGIB
0001100663,S000013699,iShares Broad USD Investment Grade Corporate Bond ETF,C000037541,iShares Broad USD Investment Grade Corporate Bond ETF,USIG
0001100663,S000013700,iShares Intermediate Government/Credit Bond ETF,C000037542,iShares Intermediate Government/Credit Bond ETF,GVI
0001100663,S000013701,iShares Government/Credit Bond ETF,C000037543,iShares Government/Credit Bond ETF,GBF
0001100663,S000016772,iShares iBoxx $ High Yield Corporate Bond ETF,C000046846,iShares iBoxx $ High Yield Corporate Bond ETF,HYG
